{
  "case_id": "validation_fb90c60d",
  "goal": "Restore discoverability of the documented truncated-input v2 diagnostic while preserving the existing catalog entries.",
  "sandbox_fixture": "sha256:265ed5eb9352b590962ce049d867ab5b890f163bce1ddd8aece6631a71b03087",
  "world_ref": "sha256:d7f93051030c3f7a03442a99b12be77949a55f1ced1985bc34e16bd5d57289bc",
  "family_id": "validation_family_568"
}
