{
  "case_id": "validation_e25e518e",
  "goal": "Find the dusk alias in the apiary files and run that named test.",
  "sandbox_fixture": "sha256:40ce319637d8a0e60cccbdc0202fd76fc331b503d2382511507b3140438616da",
  "world_ref": "sha256:afa4896d40a68177e86c51574e940ff16633076434acd57a16e00c22e787f1b0",
  "family_id": "validation_family_016"
}
