{
  "case_id": "validation_9a329c7f",
  "goal": "Make encoded records follow the declared field order while preserving their values.",
  "sandbox_fixture": "sha256:8d4fdb958f57ac5314fdad74377be7aed24324d468ef77f9a202d1a726950010",
  "world_ref": "sha256:d7f93051030c3f7a03442a99b12be77949a55f1ced1985bc34e16bd5d57289bc",
  "family_id": "validation_family_779"
}
